"国&地域","タイトル","URL","概要","選定理由","カテゴリ","検証状態"
"スペイン・マドリード","Luzinterruptus（匿名コレクティブ）","https://www.luzinterruptus.com/ | https://www.designboom.com/art/luzinterruptus-labyrinth-of-plastic-waste-installation-madrid-07-30-2017/","匿名の集団が、夜の公共空間に「廃棄物＋光」で数日だけ出現しては撤去する仮設インスタレーションを続ける。代表作「Labyrinth of Plastic Waste」は住民から集めた約15,000本のボトルで全長170mの光る迷路を作り、自分たちが出したごみの中で道に迷わせる反転設計。","確定技術のLEDマトリクス・映像同期・複数デバイス連携を「廃プラ×光」で作品化した最短距離の事例であり、匿名運営・会期数日という消えるアンダーグラウンド性が定番アップサイクルと明確に一線を画すため。","アートワーク（インスタレーション/期間限定）","公式確認済（公式サイトに2026年1〜6月の新作5件掲載、現行）"
"中国・北京/山東","王久良（Wang Jiuliang）「垃圾围城（Beijing Besieged by Waste）」","https://www.chinaindiefilm.org/films/beijing-besieged-by-waste/?lang=zh-hans | https://www.sfmoma.org/event/plastic-china-821/","北京を取り囲む460以上の非公式ごみ捨て場をGPSでマッピングし、写真・地図・映画を横断して「都市を包囲するゴミ」を可視化した調査報道型アート。続く「Plastic China」は廃プラ輸入の実態を描き、2017年の政策転換の世論形成に影響したとされる（メディア発）。","確定した「独自ローカルマップ+GPS（D1）」を廃棄物調査に応用した先行例そのものであり、中国国内での上映制限が語られるアンダーグラウンド性と社会介入性が強いため。","メディア表現（ドキュメンタリー・写真・地図）","#23 No（本人一次情報は未特定。作品流通は配給元で確認。政策影響はメディア報道による限定）"
"英国・ロンドン","Tim Noble & Sue Webster（シャドウ・スカルプチャー）","https://www.timnobleandsuewebster.com/ | https://en.wikipedia.org/wiki/Tim_Noble_and_Sue_Webster","自分たちが半年間に出した生活ごみの山に一点から光を当て、壁に二人の精密な自画像の影を浮かび上がらせる。ごみの山と肖像という二重像が、光源の角度で意味を反転させる。","UV/レーザー等の「光源制御」と「映像同期・錯視」を廃棄物で成立させた原型であり、カメラ+AI判別（D2）やジェネレーティブ（D3）と概念接続できる「ごみ＝自画像」の自己言及性が展示導入装置として独自だから。","アートワーク（シャドウ・スカルプチャー）","#35 Yes（公式サイト稼働、2026年展覧会情報まで更新確認）"
"米国・ロードアイランド州ティバートン","Thomas (Tom) Deininger（アナモルフィック錯視彫刻）","https://tomdeiningerstudios.com/ | https://www.ecfa.com/artists/36-thomas-deininger/overview/","週4日ビーチコーミングで自ら集めた漂着プラ・廃玩具で、特定の一視点からだけ写実的な鳥や生き物に見え、視点を外すと廃品の山に解体される一点物の錯視彫刻を作る。","「偶然性×規則性のジェネレーティブアート（D3）」「カメラ+AIによる見えの変換（D2）」と直接発想が重なり、TikTok等で拡散する一方で日本語情報がほぼ皆無というニッチ度が高いため。","アートワーク（廃品アッサンブラージュ/錯視）","要確認寄り（本人公式・取扱ギャラリーで実在裏取り済み）"
"英国・ブライトン","GOMI（gomi design）","https://gomi.design/","自治体が「リサイクル不可」とする軟質プラごみをマーブル模様の筐体に成形し、廃バッテリーを再利用したBluetoothスピーカーやモバイルバッテリーを作る。ブランド名は日本語の「ゴミ」由来。","廃プラ×廃バッテリーで電子デバイスを作る稀少例で、藤クリーンの「ゴミ製の筐体に技術を仕込む」構成の実在プロトタイプになるため。","プロダクト（電子機器×廃プラ）","公式確認済（公式サイト稼働）"
"ケニア・ナイロビ","Cyrus Kabiru「C-Stunners」","https://www.designindaba.com/videos/creative-work/kenyan-artist-creates-eccentric-eyeglasses-electronic-waste | https://www.edcrossfineart.com/exhibitions/38-c-stunners-cyrus-kabiro/overview/","路上・ごみ捨て場で集めたe-wasteや廃品で彫刻的な眼鏡を作り、自ら装着して写真作品化する。「眼鏡＝視点の道具」をごみで作る自己言及性が核。","確定技術「触覚UI（ゴミ製）」＝身体に着ける廃棄物インターフェースの発想源であり、NFC/センサーを仕込んだウェアラブル型ゴミデバイスへ概念接続できるため。","アートワーク（ウェアラブル彫刻・写真）","準公式（デザイン機関・取扱ギャラリーで裏取り）"
"日本・福岡県糸島市拠点","藤浩志「かえっこ」/「Jurassic Plastic（ToySaurus）」","https://www.fujistudio.co/ | https://www.fujistudio.co/kaekko-1 | https://bijutsutecho.com/exhibitions/4020","家庭の廃プラ玩具を、子どもだけの通貨「カエルポイント」で循環させる遊びの仕組み「かえっこ」を考案し、交換されず残った玩具の山を色別選別して恐竜の巨大オブジェに組む。","NFC（通貨/カード）・重量/色による選別・参加型システムという確定技術群を、廃棄物×市民参加で自走拡散させた国内最古参級モデルで、「通貨・ポイント化」の設計に直接転用できるため。","アートワーク＋参加システム","公式確認済（本人公式サイト稼働）"
"オランダ・アムステルダム","Plastic Whale","https://plasticwhale.com/plastic-fishing/ | https://plasticwhale.com/","運河のプラごみを「釣り」、獲れ高と珍品を競うゲーム化された清掃体験を提供する世界初の「プロのプラスチック釣り会社」。","「重量センサー×ゲーミフィケーション（獲れ高の可視化）」の実運用例で、藤クリーンのツアー体験に直結するため。","現場×体験（プロダクト連動）","#16 Yes（一般ツアー予約導線稼働・2026年実績確認）"
"ブラジル・サンパウロ","Mundano / Pimp My Carroça","https://pimpmycarroca.com/sobre/ | https://en.wikipedia.org/wiki/Mundano","廃品回収人（カタドール）の手押し車をアーティストが補修・彩色して路上の作品に変え、健康・心理支援まで束ねる自走型ムーブメント。回収人と市民をつなぐアプリ「Cataki」も派生した。","「複数デバイス連携＋アプリ＋GPS」を廃棄物文脈で実装した稀少例で、藤クリーンの「人×アプリ×地図」の設計に接続できるため。","ストリートアート＋社会運動","#21 部分Yes（公式ブログ2026-07-02まで活動確認）"
"オランダ・アイントホーフェン発 → 世界","Precious Plastic","https://www.preciousplastic.com/ | https://en.wikipedia.org/wiki/Precious_Plastic","小型プラ再生機械の設計図をオープンソース化し、世界100カ国超・500拠点超のDIYリサイクル網を形成。","ラズパイ的オープンハードウェア＋自作機械＋分散運営という、藤クリーンが「作る道具」を内製・公開する際の設計思想の直接参照になるため。","プロダクト（オープンソース機械/ムーブメント）","#8 Yes（公式稼働・V5開発中）"
"台湾・台北","Miniwiz（小智研發）「Trashpresso」「EcoARK」","https://www.miniwiz.com/ | https://circular-taiwan.org/en/case/miniwiz/","太陽光駆動の移動式リサイクル工場「Trashpresso」をコンテナに収めて運ぶ「機械のツアー化」を実践。廃棄物由来素材1,200種以上をデータベース化。","「移動する機械＋センサー＋素材データベース」という技術寄り事例で、素材DBはNFC/識別による素材トレースの発想源になるため。","プロダクト（素材開発）＋メディア表現（建築）","公式＋準公式で裏取り"
"中国・北京/深圳","堅果兄弟（Nut Brother）「塵埃計画（Project Dust）」","https://nutbrother.wordpress.com/ | https://actipedia.org/project/chinas-vacuum-cleaner-artist-turning-beijings-smog-bricks","工業用掃除機を押して北京を100日間歩き、吸引した大気中の粉塵約100gを粘土と混ぜて1個のレンガに焼成した。","「重量センサー＋センサーで不可視の廃棄物を計る」という測定＝表現のアイデア源で、産廃ツアーで“見えないもの”を数値化・物質化する演出に接続できるため。","アートワーク（パフォーマンス）","#24 Yes（本人公式WordPress稼働）"
"米国・NY発の巡回インスタレーション","The Plastic Bag Store（Robin Frohardt）","http://www.robinfrohardt.com/plastic-bag-store-1 | https://www.theplasticbagstore.com/","廃プラ袋・包装材だけで手作りした数千点の「商品」が並ぶ偽スーパーで、閉店後に店内が人形劇の舞台に変形する二段構え。","「イマーシブ空間＋映像同期」を廃棄物で成立させた稀少例で、藤クリーンの展示空間×映像演出の設計に直結するため。","アートワーク（没入インスタレーション＋人形劇フィルム）","#6 部分Yes（MASS MoCA終了は公式確認）"
"シンガポール","Tan Zi Xi（Messymsxi）「Plastic Ocean」","https://messymsxi.sg/ | https://www.artsy.net/artwork/zi-xi-tan-plastic-ocean","約26,000点の廃プラを天井から吊るし、鑑賞者が「ごみの海の中を漂う」没入体験を作る。素材は巡回時に現地のリサイクル市場から調達。","大量の廃プラ×照明・映像による没入環境という点でLEDマトリクス・映像同期に接続できるため。","アートワーク（没入型インスタレーション）","#26 Yes（本人公式稼働・直近作品2025-09）"
"チェコ・プラハ","Veronika Richterová / PET-ART Museum","https://www.veronikarichterova.com/en/pet-art-museum-3/ | https://www.veronikarichterova.com/","廃ペットボトルを切る・熱する・ねじるだけで動植物やシャンデリアに変える「PET-ART」を続け、私設博物館で76カ国3,000本超のボトルをアーカイブする。","「収集品を識別・分類してアーカイブ化（NFC/データベース）」と「サーマル（加熱成形）」の両方に接続できるため。","アートワーク（PETボトル彫刻）＋私設博物館","#19 部分Yes（見学可否/所在地は一次情報なし）"
"米国・カリフォルニア州ポイントレイズ","One Beach Plastic（Richard Lang & Judith Selby Lang）","https://www.beachplastic.com/ | https://marinarts.org/event/one-beach-plastic-part-of-climate-fest-2025-richard-lang-judith-selby-lang/","夫婦が1999年から25年以上、「同じ1,000mの汀線」だけに数百回通い、累計2トン超の漂着プラを採集・色別キュレーションして作品化する。","「特定地点の定点観測（GPS/D1）＋時系列データ化」という発想が、藤クリーンのローカルマップ×継続記録に直結するため。","アートワーク（個人・データ的アーカイブ）","公式確認寄り（2025年出展/講演で裏取り）"
"米国・ニューヨーク","Treasures in the Trash（ネルソン・モリーナ・コレクション）","https://www.sanitationfoundation.org/m11-treasures-in-the-trash","清掃員が34年間の収集業務中にごみから救い出した約4万点を、現役清掃車庫の2階に陳列した非公式ミュージアム。","「収集品のタグ付け・分類アーカイブ（NFC/データベース）」の発想源であり、“清掃の現場に博物館がある”構図が藤クリーンの現場開放×収蔵展示の直接モデルになるため。","現場×私設博物館（キュレーション）","#4 Yes（一般ツアー現在非実施・恒久収蔵先を模索中を明記）"
"英国・ロンドン","Skip Gallery","https://www.skipgallery.com/","建設廃棄物用スキップ（産廃コンテナ）そのものを展示空間にする移動ギャラリー。駐車1台分があればどこでも開廊できる。","「産廃コンテナ＝可搬な展示ユニット」という発想が、藤クリーンの機材を仕込んだ移動展示ボックスの設計に接続するため。","アートワーク（移動ギャラリー/ストリート）","#5 Yes（公式稼働・直近確定は2024-10）"
"南アフリカ・ヨハネスブルグ","Mbongeni Buthelezi","https://www.instagram.com/buthelezimbongeniart/ | https://www.cnn.com/style/article/mbongeni-buthelezi-plastic-artist-south-africa-spc-intl/index.html","拾った廃ビニールをヒートガンで溶かして「絵具として塗る」独自技法で、色付きプラ袋だけでポートレートを描く「プラスチックの油彩画」を制作する。","確定技術「サーマル（加熱）」を廃プラの描画メディア化に転用した先鋭例で、藤クリーンの“熱で溶かす/描く”表現に直結するため。","アートワーク（絵画）","#27 部分Yes（公式サイトDNS失効・Instagramで実在確認）"
"日本・大阪/東京","三島喜美代","https://www.neribun.or.jp/event/detail_m.cgi?id=202401281706414617 | https://www.tokyoartbeat.com/articles/-/kimiyo-mishima--passing-news-202406","新聞・空き缶・段ボールなどの「ゴミ」を陶に転写して焼成する「割れる印刷物」を1970年代から制作。産業廃棄物の溶融スラグを素材にした作品もある。","「印刷転写＋焼成（サーマル）」がサーマルプリンターと概念接続でき、産廃スラグを扱う歴史的正統性が“なぜ産廃×アートなのか”の説明軸になるため。","アートワーク（陶/転写）","準公式（美術館公式）＋メディア"
"日本・東京","藤元明「NEW RECYCLE」/「海ごみのあと」","https://www.kanakawanishi.com/akira-fujimoto | https://prtimes.jp/main/html/rd/p/000000031.000015900.html","リサイクルマークを作品として更新する概念プロジェクト「NEW RECYCLE」で廃棄物の「価値の転換」自体をテーマ化し、浜辺で海洋プラを現地で溶かし固めるシリーズなど素材と場所の結び付け方が独自。","「記号の再設計＝ジェネレーティブ（D3）」と「現地で溶かす（サーマル）」の両面に接続できるため。","アートワーク（コンセプチュアル）","準公式（ギャラリー）＋プレスリリース"
"日本・京都府亀岡市","かめおか霧の芸術祭 / HOZUBAG Mfg.","https://kameoka-kiri.jp/ | https://kameoka-kiri.jp/kiri2-art-colleage/hozubag-mfg/","環境先進都市政策と一体のローカル芸術祭から、退役パラグライダーの翼をアップサイクルするバッグ工場「HOZUBAG」が生まれた。芸術祭が単発展示で終わらず「工場」という恒常インフラと雇用を生んだ。","裁断加工（UV/レーザー）や「芸術祭→常設化」の設計が、瀬戸内芸術祭×藤クリーンの持続構造の国内先行モデルになるため。","メディア表現（芸術祭）＋プロダクト","公式確認済（2026年会期告知あり）"
"ポルトガル・リスボン","Bordalo II「Big Trash Animals」","https://www.bordaloii.com/ | https://en.wikipedia.org/wiki/Bordalo_II","街のゴミ（バンパー・タイヤ・家電）で「その汚染の被害者である動物」の巨大レリーフを世界中の壁に制作する。","廃品を触覚的に組み上げる「触覚UI（ゴミ製）」の造形強度が高く、ストリートで都市そのものをメディア化する手法が参照になるため。","アートワーク（ストリートアート）","#7 Yes（公式178トンを採用推奨）"
"カナダ / ケニア・ナイロビ","Benjamin Von Wong「Turn Off the Plastic Tap」","https://www.vonwong.com/ | https://www.thisiscolossal.com/2022/03/benjamin-von-wong-plastic-tap/","高さ約9mの巨大蛇口からプラごみが流れ出るインスタレーションを国連会議の場に設置し、条約交渉に直接介入する。","「場所・タイミング×量」の設計と映像同期・SNS連携による拡散設計が、藤クリーンの発信戦略に接続するため。","アートワーク（インスタレーション/キャンペーン）","#10 Yes（本人公式で2021-2025年の年譜確認）"
"パラグアイ / 米国","Recycled Orchestra of Cateura ＋「Landfill Harmonic」","https://en.wikipedia.org/wiki/Landfill_Harmonic | https://www.macfound.org/documentaryfilm/landfill-harmonic","埋立地カテウラのゴミから作った楽器で子どもたちがオーケストラを結成し、ドキュメンタリー・世界ツアーで「ゴミ→楽器→音楽→誇り」の変換の連鎖を実現した。","本リストで手薄な「音・聴覚の廃棄物表現」の代表で、映像同期（演奏×映像）に接続できるため。","メディア表現（音楽・映画）","メディア＋準公式（結成年はソース間で揺れ・要注記）"
"タイ・サムットプラーカーン","ワット・チャクデーン（Wat Chak Daeng）「ペットボトル法衣」","https://www.eco-temple.net/a-temple-turned-recycling-center/ | https://www.bangkokpost.com/life/social-and-lifestyle/1761634/from-humble-plastic-bottles-to-highly-desirable-monks-robes","仏教寺院が廃PETボトルを繊維化して僧侶の袈裟に再生し、「ごみの寄進」が功徳になるという宗教的意味の転換を実現した。","「信仰×廃棄物」という文化的独自性が突出し、寄進の記録・可視化（NFC/カウント）に概念接続できるため。","プロダクト＋コミュニティ活動（信仰）","準公式（仏教系ネットワーク）＋メディア"
"ベナン・ポルトノボ","Romuald Hazoumè（ロミュアルド・アズメ）","https://gagosian.com/artists/romuald-hazoume/ | https://collection.qagoma.qld.gov.au/stories/1813","ガソリン密輸で火に炙られ膨張した廃ジェリカンを、ヨルバの仮面の造形文法で「顔」に変える。","ヴードゥー/ヨルバ文化と廃棄物を結ぶ文化的深度が高く、廃品の触覚的造形（触覚UI）＋顔認識的なモチーフ（D2）に接続するため。","アートワーク","準公式（ギャラリー・州立美術館）"
"ガーナ・アクラ","Serge Attukwei Clottey「Afrogallonism」","https://www.gallery1957.com/artists/35-serge-attukwei-clottey/ | https://www.designboom.com/art/afrogallonism-serge-attukwei-clottey-yellow-gallons-venice-architecture-biennale-05-19-2023/","黄色いポリタンクを切断・縫合して巨大なタペストリー状インスタレーションにする。容器の来歴に水危機・植民地経済を重ねる。","「Afrogallonism」という造語でコンセプトをパッケージ化する言語設計が独自で、廃品の面的連結（触覚UI）が参照になるため。","アートワーク（インスタレーション）","準公式（ギャラリー）＋メディア"
"オーストラリア・トレス海峡エラブ島","Erub Arts（ゴーストネット・アート）","https://www.erubarts.com.au/ | https://www.sea.museum/whats-on/exhibitions/ghost-nets-of-the-ocean","海を漂う放棄漁網（ゴーストネット）を先住民コミュニティが編み、海洋生物の彫刻に変える協働アート。","「地域固有のごみ×土着の手仕事」という組み合わせが瀬戸内の海ごみ文脈と重なり、編む/組む触覚UIに接続するため。","アートワーク","公式＋準公式（国立海事博物館）"
"ハイチ・ポルトープランス","Ghetto Biennale / Atis Rezistans","https://ghettobiennale.org/ | https://documenta-fifteen.de/en/lumbung-members-artists/atis-rezistans-ghetto-biennale/","廃車部品・スクラップ等を組む彫刻家集団が、自分たちの街区に世界の作家を呼ぶ「逆方向の国際展」を発明。ドクメンタ15まで到達した。","「廃棄物アートの共同体が芸術祭の主催者になる」自律モデルがアンダーグラウンド性の極北で、藤クリーン×芸術祭の“当事者主導”の在り方を最も鋭く提示するため。","アートワーク＋メディア表現（芸術祭）","#29 Yes（公式で直近第8回2024確認）"
"日本・東京都武蔵野市","武蔵野クリーンセンター / gomi_pit BAR","https://www.city.musashino.lg.jp/kurashi_guide/gomi_kankyou_eisei/clean_center/1024899.html | https://mues-ebara.com/","ガラス張りでごみピットとクレーンを見せる清掃工場で、ピット前でクラフトビールを飲む「gomi_pit BAR」を開催し迷惑施設を体験の場に反転した。","「現場開放×体験の反転」型の国内アンカー。稼働クレーンの重量計測・映像同期・LED演出と親和し、藤クリーンの産廃ツアーが“なぜ現場を見せるのか”を説明する基準点（seed収録済み・比較用）。","メディア表現（施設・イベント）","#1 部分Yes（バー2021以降の開催は一次情報なし）"
"日本・香川県豊島","豊島のこころ資料館","https://www.teshima-school.jp/struggle/history/ | https://kougai.info/archives/887","国内最大級の産廃不法投棄事件の現場に建つ住民手づくり資料館。不法投棄業者の元事務所を転用し、シュレッダーダストの剥ぎ取り標本を「歴史の証人」として展示する。","瀬戸内・藤クリーンという地域文脈の核であり、産廃ツアーの倫理・トーン設計の基準点（seed収録済み）。","メディア表現（資料館）","#3 部分Yes（2026-03受入統計まで県公式で確認）"
"イタリア/オランダ（委嘱は豪NGV）","Formafantasma「Ore Streams」","https://formafantasma.com/work/ore-streams | https://www.ngv.vic.gov.au/essay/ore-streams-table/","電子廃棄物のリサイクル実態を2年間調査し、e-waste混入の家具＋18チャンネル映像で「地上採掘」を提示。","「調査・データ可視化＋多チャンネル映像同期」の型のアンカーで、e-waste（＝ラズパイ/NFC等の技術素材）を結ぶ基準点（seed収録済み）。","アートワーク（デザインリサーチ）＋メディア表現","収集時点公式（2017年・参照現役）"
